The process by which the primitive node induces the overlying ectoderm to thicken into a plate is called _____.,Neural induction
On which day of human development does the neural plate first form?,Day 18
Which embryonic structure acts as the primary inducer for the formation of the central nervous system rudiment?,The primitive node
The neural plate consists of a thick plate of which specific cell type?,"Pseudostratified, columnar neuroepithelial cells"
In which direction does the differentiation of the neural plate typically proceed?,Cranial-to-caudal
The lateral edges of the neural plate that detach during tube formation are called _____ cells.,Neural crest
Which specific process converts the neural plate into a hollow neural tube?,Neurulation
"By day 28, the brain is divided into which three primary vesicles?","Prosencephalon, mesencephalon, and rhombencephalon"
The prosencephalon (forebrain) subdivides into which two secondary vesicles during the fifth week?,Telencephalon and diencephalon
The rhombencephalon (hindbrain) subdivides into which two secondary vesicles?,Metencephalon and myelencephalon
How many secondary brain vesicles exist in total by the end of the fifth week?,Five
"What are the transient, repetitive segments that partition the developing hindbrain called?",Rhombomeres
"The mesencephalic flexure, located at the midbrain, is directed in which anatomical direction?",Ventrally
The dorsally directed fold that begins at the location of the developing pons is the _____ flexure.,Pontine
Where is the cervical flexure located in the developing neural tube?,Near the juncture between the myelencephalon and the spinal cord
"Within the differentiating neural tube, in which layer does mitosis of neuroepithelial cells occur?",Ventricular layer
Which layer of the developing neural tube contains the neuronal cell bodies and becomes gray matter?,Mantle layer
The marginal layer of the central nervous system contains nerve fibers and becomes _____ matter.,White
Which specialized glial cells serve as the physical scaffolding for migrating neurons during brain development?,Radial glial cells
Which cells are responsible for forming myelin sheaths in the central nervous system?,Oligodendrocytes
"Schwann cells, which form myelin sheaths in the peripheral nervous system, are derived from _____.",Neural crest cells
Nerve cell bodies in the peripheral nervous system (PNS) aggregate into structures called _____.,Ganglia
What is the function of satellite cells in the peripheral nervous system?,They surround and support nerve cell bodies within ganglia
Which specific cells line the central canal of the spinal cord and the ventricles of the brain?,Ependymal cells
On which day of human development does the heart typically begin to beat?,Day 21
The human heart begins pumping blood by which day(s) of development?,Day 24 to 25
The cardiac primordium forms within which embryonic tissue layer?,Splanchnic mesoderm
What name is given to the cardiac progenitor region at the cranial end of the embryonic disc?,Cardiac crescent (or first heart field)
Which process is responsible for the formation of the lateral endocardial tubes?,Vasculogenesis
The single primary heart tube is formed by the fusion of endocardial tubes due to which embryonic process?,Lateral body folding
List the three basic layers of the primary heart tube from internal to external.,"Endocardial tube, cardiac jelly, and myocardium"
The extracellular matrix situated between the endocardium and myocardium in the early heart is the _____.,Cardiac jelly
Which heart tube segment is added by the second heart field to form the primitive right ventricle?,The outflow tract
"During heart looping, the primitive atrium is displaced in which directions?",Dorsally and cranially
The epicardium originates from a special group of mesodermal cells called the _____.,Proepicardial organ
The proepicardial organ is located in the region of which heart tube segment?,Sinus venosus
The coronary sinus develops from which embryonic heart structure?,The left sinus horn (of the sinus venosus)
Which layer of the adult heart is histologically equivalent to the tunica intima of blood vessels?,Endocardium
The tunica media of a blood vessel is functionally comparable to which layer of the heart?,Myocardium
What are the three layers of the wall of a typical artery or vein?,"Tunica intima, tunica media, and tunica adventitia"
The de novo formation of blood vessels from endothelial precursor cells is called _____.,Vasculogenesis
The budding and sprouting of new vessels from existing endothelial cords is known as _____.,Angiogenesis
What are the cell aggregations in the yolk sac wall that give rise to both blood and endothelial lineages?,Hemangioblasts
Clusters of hemangioblasts and blood cells within the yolk sac are called _____.,Blood islands
When does blood vessel formation begin in the human yolk sac?,Day 17
"In the central nervous system, gray matter is primarily composed of _____.",Neuronal cell bodies
What type of epithelium characterizes the early neural plate?,Pseudostratified columnar epithelium
Which structure connects the primitive atrium to the primitive left ventricle in the heart tube?,Atrioventricular (AV) canal
Which brain vesicle gives rise to the cerebral hemispheres?,Telencephalon
The thalamus and hypothalamus develop from which secondary brain vesicle?,Diencephalon
Which secondary vesicle develops into the pons and cerebellum?,Metencephalon
The myelencephalon eventually forms which adult brain structure?,Medulla oblongata
Neural crest cells undergo which specific cellular transformation to begin migration?,Epithelial-to-mesenchymal transformation (EMT)
Which neuropore typically closes first during human neurulation?,Cranial neuropore (Day 24)
On which day of development does the caudal neuropore typically close?,Day 26
The dorsal portion of the telencephalon that forms the cerebral cortex is called the _____.,Pallium
What is the fate of the primitive right ventricle during heart development?,It contributes to the definitive right ventricle
Which transcription factor is predominantly expressed in the pacemaker and conducting system of the developing heart?,TBX3
The intraembryonic source of definitive hematopoietic stem cells is the _____ region.,Aorta-gonad-mesonephros (AGM)
What is the process called where existing vessels split to generate additional vessels?,Vascular intussusception (non-sprouting angiogenesis)
"Which embryonic system drains the head, neck, and body wall during early development?",The cardinal system
The umbilical veins carry which type of blood from the placenta to the embryo?,Oxygenated blood
Which heart horn receives all systemic venous blood after remodeling is complete?,Right sinus horn (via superior and inferior caval veins)
"In the developing heart, the division of the outflow tract creates the ascending aorta and the _____.",Pulmonary trunk
The sharpening of expression domains in the neural tube is often achieved by transcription factors that _____ each other.,Mutually repress
"Which signaling molecule, secreted by the floor plate, regulates ventral patterning of the neural tube?",Sonic hedgehog (Shh)
What is the term for the broad cranial portion of the neural plate that will give rise to the brain?,Presumptive brain
Which structure lies at the midline just deep to the neural plate and aids in its induction?,Notochord
The sharp flexure separating the prosencephalon from the mesencephalon is the _____ flexure.,Mesencephalic
"In the adult heart, what is the layer equivalent to the tunica adventitia of a blood vessel?",Epicardium
The process where the neural plate narrows transversely and lengthens longitudinally is called _____.,Convergent extension
The brain and spinal cord develop from which embryonic structure?,Neural tube
Which secondary vesicle contains the ganglionic eminences that give rise to basal ganglia?,Telencephalon
The major shift of systemic venous return to the right side of the heart involves the remodeling of which system?,Venous system (Sinus venosus)
"What is the primary role of the third brain flexure, the pontine flexure?",It folds the metencephalon back against the myelencephalon
Cells in the adult brain that retain the ability to divide and differentiate into neurons are called _____.,Neural stem cells
Which embryonic layer provides the inductive signals for the formation of the cardiac lineage?,Endoderm
The space within the heart tube before septation is initially a _____ tube.,Single
Which specific cardiac structure develops into the moderator band?,Muscular ventricular septum
Where do the paired dorsal aortae initially develop relative to the notochord?,On either side of the notochord
What term is used for endothelial precursor cells derived from splanchnic mesoderm?,Angioblasts (or EPCs)
The connection between the yolk sac and the paired dorsal aortae is mediated by which vessels?,Vitelline arteries
The transverse pericardial sinus forms by the rupture of which structure?,Dorsal mesocardium
Which tissue type forms the valves of the heart during septation?,Endocardial cushion tissue
A failure of the endocardial heart tubes to fuse in the midline results in a condition called _____.,Cardia bifida